handleId,fieldType,name,description,productImageUrl,collection,sku,ribbon,price,surcharge,visible,discountMode,discountValue,inventory,weight,productOptionName1,productOptionType1,productOptionDescription1,productOptionName2,productOptionType2,productOptionDescription2,productOptionName3,productOptionType3,productOptionDescription3,productOptionName4,productOptionType4,productOptionDescription4,productOptionName5,productOptionType5,productOptionDescription5,productOptionName6,productOptionType6,productOptionDescription6,additionalInfoTitle1,additionalInfoDescription1,additionalInfoTitle2,additionalInfoDescription2,additionalInfoTitle3,additionalInfoDescription3,additionalInfoTitle4,additionalInfoDescription4,additionalInfoTitle5,additionalInfoDescription5,additionalInfoTitle6,additionalInfoDescription6,customTextField1,customTextCharLimit1,customTextMandatory1,brand
product_0,Product,Yıldız İç Giyim 2001 Erkek Penye Atlet Beyaz CİHAN 2001,"15 gün içinde ücretsiz iade. Detaylı bilgi için tıklayın.

Bu ürün giyimsepeti tarafından gönderilecektir.
Cihan 2001 erkek penye atlet /beyaz/m
Bu üründen en fazla 10 adet sipariş verilebilir. 10 adetin üzerindeki siparişleri Trendyol iptal etme hakkını saklı tutar.
Kampanya fiyatından satılmak üzere 100 adetten fazla stok sunulmuştur.
İncelemiş olduğunuz ürünün satış fiyatını satıcı belirlemektedir.
Bir ürün birden fazla satıcı tarafından satılabilir. Ürün liste ve detay sayfalarında tüketici memnuniyeti göz önüne alınarak fiyat avantajı, teslimat hızı, iade oranları ve genel hizmet kalitesine göre belirlenmiş puanı en yüksek satıcı görünür satıcı olur. Diğer satıcılar, ürün detay sayfasında alternatif olarak listelenirler.",https://cdn.dsmcdn.com/ty224/product/media/images/20211103/16/164984013/249528287/1/1_org_zoom.jpg,2/ All Clothes,,,28.79,,FALSE,PERCENT,0,InStock,0,Size,DROP_DOWN,S;M;L;XL,,,,,,,,,,,,,,,,,,,,,,,,,,,,,,,
